videoId,title,commentId,textDisplay,authorDisplayName,likeCount,publishedAt,updatedAt
1YIqpPA9uV0,ITZY - 'NOT SHY' [ENGLISH VERSION] Lyrics [Color Coded_Eng],Ugwi1h1LQjkUjTX0xP14AaABAg,"I like how they actually do their best to pronounce the words as clearly as they can, especially Yeji. As we all real ITZY fans know that Yeji's English is not as fluent as Lia Chaeryeong or Ryujin but she still slayed her parts clearly. I'm genuinely so proud of them as a whole.",JimBob Smith Jr.,1076,2021-01-22T15:21:30Z,2021-01-22T15:22:58Z
1YIqpPA9uV0,ITZY - 'NOT SHY' [ENGLISH VERSION] Lyrics [Color Coded_Eng],UgydxnyUI72m6we7F2V4AaABAg,“cuz the word hesitate aint a part of my game” its just brilliant,jisooyah,5655,2021-01-22T06:02:46Z,2021-01-22T06:02:46Z
1YIqpPA9uV0,ITZY - 'NOT SHY' [ENGLISH VERSION] Lyrics [Color Coded_Eng],UgwkRXDVjLzLRj_ewyJ4AaABAg,We need a full english solo for Lia because her english is *chefs kiss*,Ren,2722,2021-01-22T07:26:38Z,2021-01-22T07:26:38Z
1YIqpPA9uV0,ITZY - 'NOT SHY' [ENGLISH VERSION] Lyrics [Color Coded_Eng],UgwlyIcPCkmsgub_i2Z4AaABAg,Okay but... Lia singing english lyrics just hits differently 😭😭❤️❣️💕💗,tomorrowxtuduro global shooky,911,2021-01-22T07:41:51Z,2021-01-22T07:41:51Z
1YIqpPA9uV0,ITZY - 'NOT SHY' [ENGLISH VERSION] Lyrics [Color Coded_Eng],Ugw2MgSKDOtCQYvDmvh4AaABAg,"Yeji: Not Shy Not Me
Me: Give me da da da da 
Yeji: Tell me now if you're d-d-d-d-down
Me: Oh, right, its the english version of not shy",•_zb_•,2944,2021-01-22T07:45:58Z,2021-09-04T14:33:37Z
1YIqpPA9uV0,ITZY - 'NOT SHY' [ENGLISH VERSION] Lyrics [Color Coded_Eng],Ugwm9QLWYj-omOxTEW94AaABAg,"Even when she sings just like talking, Lia’s voice sound lower and I like it 🥰😍",JAYH,486,2021-01-22T07:16:14Z,2021-01-22T07:16:14Z
1YIqpPA9uV0,ITZY - 'NOT SHY' [ENGLISH VERSION] Lyrics [Color Coded_Eng],UgxbATDd8TjGFnbFE2Z4AaABAg,I literally predicted them saying ‘We make a great pair’ lol also Lia and Yuna sounds amazing sounds saying that line! 🥰,Vanessa G,628,2021-01-22T06:10:48Z,2021-01-22T06:10:58Z
1YIqpPA9uV0,ITZY - 'NOT SHY' [ENGLISH VERSION] Lyrics [Color Coded_Eng],UgzJF_EzFntW74pEvJJ4AaABAg,Imagine That They Will Sing The Not Shy Song(English Version) In The Late Show,Xx_MaximumLightning2023_xX,949,2021-01-22T05:52:53Z,2021-01-22T05:52:53Z
1YIqpPA9uV0,ITZY - 'NOT SHY' [ENGLISH VERSION] Lyrics [Color Coded_Eng],UgzMJ6d9jwfbU9ujUsN4AaABAg,"CHAERYEONG
                          IS
                              A
                                  VISUAL
                                                 EVEN
                                                             IN 
                                                                  ZEPETO
                                                                                   VERSION",Melanny Ratliff,212,2021-01-23T03:42:28Z,2021-01-23T03:42:28Z
1YIqpPA9uV0,ITZY - 'NOT SHY' [ENGLISH VERSION] Lyrics [Color Coded_Eng],UgwIWrS8gGLYnVkNRNp4AaABAg,Lia's voice singing in english is so elegant and slightly deep while in the original she sounds so cute and sweet,DINO,64,2021-03-05T07:33:33Z,2021-03-05T07:33:33Z
1YIqpPA9uV0,ITZY - 'NOT SHY' [ENGLISH VERSION] Lyrics [Color Coded_Eng],UgzLvz8ezhXEKjLH-fR4AaABAg,This is the perfect way to do an English version. The lyrics actually make sense AND they fit the original rhythm of the song.,Boop,12,2022-08-05T04:44:01Z,2022-08-05T04:44:01Z
1YIqpPA9uV0,ITZY - 'NOT SHY' [ENGLISH VERSION] Lyrics [Color Coded_Eng],UgzWJSVEkWqwWHsQnI14AaABAg,LIAS VOICE IS JUST INTERNATIONAL,poshislove,63,2021-01-23T17:13:30Z,2021-01-23T17:13:30Z
1YIqpPA9uV0,ITZY - 'NOT SHY' [ENGLISH VERSION] Lyrics [Color Coded_Eng],UgyHZgQdZiYWtMeFKiJ4AaABAg,Cool song,Ayesha Malik,2,2022-09-16T13:29:16Z,2022-09-16T13:29:16Z
1YIqpPA9uV0,ITZY - 'NOT SHY' [ENGLISH VERSION] Lyrics [Color Coded_Eng],UgwtKZEAvoT7Cjjr_UR4AaABAg,lia’s voice in english is something else 🖤,yebi,11,2021-01-25T17:53:38Z,2021-01-25T17:53:38Z
1YIqpPA9uV0,ITZY - 'NOT SHY' [ENGLISH VERSION] Lyrics [Color Coded_Eng],Ugxr6QJsnX1iEdfO3r94AaABAg,"Chaeryeong's ""Let the beat drop"" hits different",H4Z3,784,2021-01-22T06:38:18Z,2021-01-22T06:38:18Z
1YIqpPA9uV0,ITZY - 'NOT SHY' [ENGLISH VERSION] Lyrics [Color Coded_Eng],UgzYB-3vRRClcJARexZ4AaABAg,"Yeji, Chaeryeong and Yuna have impressive pronunciation but Ryujin is on another level in my opinion (and Lia of course but she’s fluent).",ZOË ANASTASIA GINGRAS-THÉRIAULT,38,2021-01-22T14:36:25Z,2021-01-22T14:36:25Z
1YIqpPA9uV0,ITZY - 'NOT SHY' [ENGLISH VERSION] Lyrics [Color Coded_Eng],Ugweq49sSbZLEqqTQOV4AaABAg,This so good!!!!!! The translation + their pronounciaton are so seamless!!! Queens<3333,jupiter 9,32,2021-01-22T06:30:09Z,2021-01-22T15:40:56Z
1YIqpPA9uV0,ITZY - 'NOT SHY' [ENGLISH VERSION] Lyrics [Color Coded_Eng],Ugx6VP9rdnGKP5e-XBN4AaABAg,"Everybody in the comments: Lee Minho Lee Minho cuz I’m not shy 

Me: Can’t unhear it !!",kpop jjang,3352,2021-01-22T06:15:56Z,2021-01-22T06:15:56Z
1YIqpPA9uV0,ITZY - 'NOT SHY' [ENGLISH VERSION] Lyrics [Color Coded_Eng],UgzSLpaYR-ONaBC718Z4AaABAg,lia's voice sounds like Disney Princess voice✨,marelda♡,47,2021-01-23T16:40:27Z,2021-01-23T16:40:27Z
1YIqpPA9uV0,ITZY - 'NOT SHY' [ENGLISH VERSION] Lyrics [Color Coded_Eng],Ugwa0EkIPcU572a_uTx4AaABAg,Me estoy Aprendienda Rolita Para la clase de música😼👍,kami pitufo,2,2021-03-19T17:16:11Z,2021-03-19T17:16:11Z
1YIqpPA9uV0,ITZY - 'NOT SHY' [ENGLISH VERSION] Lyrics [Color Coded_Eng],Ugwo-JRIykZDTlOljVt4AaABAg,omg Lia T.T her voice shines so much im cryinggg its so good,apple strudel,48,2021-01-22T14:31:39Z,2021-01-22T14:31:39Z
1YIqpPA9uV0,ITZY - 'NOT SHY' [ENGLISH VERSION] Lyrics [Color Coded_Eng],UgyHAxpyaVpnNboGOnt4AaABAg,0:19 words cant describe how much i love this.,ariana,5,2021-05-31T22:31:12Z,2021-05-31T22:31:12Z
1YIqpPA9uV0,ITZY - 'NOT SHY' [ENGLISH VERSION] Lyrics [Color Coded_Eng],Ugz0CFevqaZC5pfE1Dl4AaABAg,ITZY's lyrics even in english is understandable. Most kpop songs that are translated in english doesn't mean anything. No offense tho. Just my opinion,n e i g h b o r n e x t d o o r,1126,2021-01-22T12:47:55Z,2021-01-22T12:47:55Z
1YIqpPA9uV0,ITZY - 'NOT SHY' [ENGLISH VERSION] Lyrics [Color Coded_Eng],UgyTrEVyDn_VABkufgR4AaABAg,"Chaeryeong's ""ITZAAAAAAAAAY"" always stays the same level of iconic no matter what.",PARTHASARATHI MURUGAIYAN,3,2022-05-29T11:35:15Z,2022-05-29T11:35:15Z
1YIqpPA9uV0,ITZY - 'NOT SHY' [ENGLISH VERSION] Lyrics [Color Coded_Eng],UgwCshzCvsT6XOCvJjh4AaABAg,Chaeryeong’s “ITZY” is everything I love all of them,Zamantha Cruz,8,2021-05-07T20:39:45Z,2021-05-07T20:39:45Z
1YIqpPA9uV0,ITZY - 'NOT SHY' [ENGLISH VERSION] Lyrics [Color Coded_Eng],UgwDUalltEx9WfAb2Xl4AaABAg,The english version of their songs are smooth and do not sound cringey.,Boss G,2,2021-12-24T02:48:44Z,2021-12-24T02:48:44Z
1YIqpPA9uV0,ITZY - 'NOT SHY' [ENGLISH VERSION] Lyrics [Color Coded_Eng],UgzLZX3nzxhTSSjO3Ld4AaABAg,""" Let's just be who we are , do what we do , we go with the flow ""  -  this hits meeeee... 😘",PRAN PRIYA,2,2021-12-18T15:00:41Z,2021-12-18T15:00:57Z
1YIqpPA9uV0,ITZY - 'NOT SHY' [ENGLISH VERSION] Lyrics [Color Coded_Eng],Ugzgezgfu3Yr5o7QsCl4AaABAg,"„Let’s just be who we are, do what we do, we go with the flow“ <3",stxrglxw,2,2022-02-12T00:58:59Z,2022-02-12T00:58:59Z
1YIqpPA9uV0,ITZY - 'NOT SHY' [ENGLISH VERSION] Lyrics [Color Coded_Eng],UgwmmwDCpPWnlDO1biV4AaABAg,"Just gonna be real, this song isn't the same without ""malhaebwa da eoseo da cause I'm not shy"" 
I mean, I low key dropped this on my crush a while back because it's so iconic. 
How did it go you ask? Well she doesn't know any korean.. 🥺",snoproian,223,2021-01-22T06:30:35Z,2021-01-22T06:33:23Z
1YIqpPA9uV0,ITZY - 'NOT SHY' [ENGLISH VERSION] Lyrics [Color Coded_Eng],UgwMc_iiCRR0-Uz2jSJ4AaABAg,wow their pronunciation and the lyric translation is just great,linda johnsone,1,2021-01-23T04:18:22Z,2021-01-23T04:18:22Z
1YIqpPA9uV0,ITZY - 'NOT SHY' [ENGLISH VERSION] Lyrics [Color Coded_Eng],UgxXQOjc8eR18f2ip-F4AaABAg,"I am not a midzy but I just started to listen to their songs its awesomee
andd in this song I loved ryujin's rap and chaeryiung's ""ITZAYY""",KEERTHANA S,2,2022-02-20T09:25:02Z,2022-02-20T09:25:02Z
1YIqpPA9uV0,ITZY - 'NOT SHY' [ENGLISH VERSION] Lyrics [Color Coded_Eng],UgwIJpkhfZ89heVvvDZ4AaABAg,Can't wait for the English ver plus choreo🥺🥺,Nicole Marie Tarroza,30,2021-01-22T05:58:15Z,2021-01-22T05:58:15Z
1YIqpPA9uV0,ITZY - 'NOT SHY' [ENGLISH VERSION] Lyrics [Color Coded_Eng],Ugz1mFOnS00pt9niUh94AaABAg,"Ok Ryujin's ""straight out of the gate, no I don't wanna wait cuz the word 'hesitate' ain't part of my game yeah"" is my new aesthetic",AsNorthAfricanAsItGets🤷‍♀️,122,2021-01-22T15:09:26Z,2021-01-22T15:09:26Z
1YIqpPA9uV0,ITZY - 'NOT SHY' [ENGLISH VERSION] Lyrics [Color Coded_Eng],UgzJSxSmXLg5DSGoVbd4AaABAg,Their English version was very savage and their pronounciation is very 👍😊😊.,Ayush Ranjan Mohanty,2,2022-02-01T10:39:22Z,2022-02-01T10:39:22Z
1YIqpPA9uV0,ITZY - 'NOT SHY' [ENGLISH VERSION] Lyrics [Color Coded_Eng],Ugy-qC_pblxIRpzkDMN4AaABAg,"RYUNJIN : Lemme know lemme know cuz.....
LEE KNOW : I'M LEE KNOW🤫🎶",MINGYU,1909,2021-01-22T05:58:13Z,2021-01-22T05:58:13Z
1YIqpPA9uV0,ITZY - 'NOT SHY' [ENGLISH VERSION] Lyrics [Color Coded_Eng],UgxEiku6qwUbYPMcgvR4AaABAg,These lyrics are definitely brilliant!😍😍😍😍😍😍😍😍😍👍👍👍👍👍👍👍👍👍👍,Wing Yeah Chanel,1,2021-01-24T16:43:45Z,2021-01-24T16:43:45Z
1YIqpPA9uV0,ITZY - 'NOT SHY' [ENGLISH VERSION] Lyrics [Color Coded_Eng],UgxlKXZ3-IOhmCwLfcN4AaABAg,"I really like the part before chaeryeon's iconic ' let the beat drop ' it feels so refreshing and perfecty portrays itzy's girl boss image
""I don't like having regrets
no matter the ending
go go let's try our best
no yes no just don't overthink things
so what if we fail
there's still a 50/50 chance of success
let's just be who we are
do what we do 
follow your heart and dive into it
Let the beat drop""",jade,0,2022-06-25T13:12:12Z,2022-06-25T13:14:53Z
1YIqpPA9uV0,ITZY - 'NOT SHY' [ENGLISH VERSION] Lyrics [Color Coded_Eng],Ugx6sgZEAm_iuUCF75Z4AaABAg,The lyrics are amazing more than I thought 😭😭😭😭😭,Stray Cat,1,2021-01-23T11:49:02Z,2021-01-23T11:49:02Z
1YIqpPA9uV0,ITZY - 'NOT SHY' [ENGLISH VERSION] Lyrics [Color Coded_Eng],UgxmrBDG22jxvkY4-I94AaABAg,"I want to know who wrote these English lyrics, because they're really good.",iring nga nagsayaw,7,2021-01-22T09:29:34Z,2021-01-22T09:29:34Z
1YIqpPA9uV0,ITZY - 'NOT SHY' [ENGLISH VERSION] Lyrics [Color Coded_Eng],UgzQDIGQB46lD_Ou2x14AaABAg,Not shy and dalla dalla are my favorite tracks from this album.... The girls kiiled it,Bharti Sawant06,4,2021-01-22T10:19:18Z,2021-01-22T10:19:18Z
1YIqpPA9uV0,ITZY - 'NOT SHY' [ENGLISH VERSION] Lyrics [Color Coded_Eng],UgxiLjG6FgSCTdsLrOR4AaABAg,they sound amazing but nothing tops the original chorus it's just too iconic,naya t.f.,0,2021-01-24T05:08:05Z,2021-01-24T05:08:05Z
1YIqpPA9uV0,ITZY - 'NOT SHY' [ENGLISH VERSION] Lyrics [Color Coded_Eng],Ugzc_wZpoBdF_gd2InR4AaABAg,CHAERYEONG's (ITZY!) always will be iconic,Fluffy,9,2021-01-23T12:49:53Z,2021-01-23T12:49:53Z
1YIqpPA9uV0,ITZY - 'NOT SHY' [ENGLISH VERSION] Lyrics [Color Coded_Eng],Ugwypvl3grYr52mFR4h4AaABAg,Finally! Love this so I can sing to it 🎤,heyrrs,2,2021-01-22T07:02:31Z,2021-01-22T07:02:31Z
1YIqpPA9uV0,ITZY - 'NOT SHY' [ENGLISH VERSION] Lyrics [Color Coded_Eng],UgyLvE6Ra2Bh90nW98x4AaABAg,"Chaeryeoung's part thooo ""you gotta keep your eyes on the prize"" SLAPS😌👌🏻",Alisha Trianda Ramadhani,12,2021-01-23T02:04:14Z,2021-01-23T02:04:41Z
1YIqpPA9uV0,ITZY - 'NOT SHY' [ENGLISH VERSION] Lyrics [Color Coded_Eng],Ugz4IA4ODH1prNH1uzV4AaABAg,"This is one of the better English versions of a song. Normally there's always a part or two that's a little awkward in translation, but this is *chef's kiss*",Juju,5,2021-01-24T17:31:11Z,2021-01-24T17:31:11Z
1YIqpPA9uV0,ITZY - 'NOT SHY' [ENGLISH VERSION] Lyrics [Color Coded_Eng],UgzrcFP3p1JmNsNalLt4AaABAg,Itzy's English versions are always good,nycto,1,2022-03-02T04:22:41Z,2022-03-02T04:22:41Z
1YIqpPA9uV0,ITZY - 'NOT SHY' [ENGLISH VERSION] Lyrics [Color Coded_Eng],UgzbK6gtzYS-w1cvRCh4AaABAg,THIS SONG IS SOOOOOOOO GOOOOOD,AIS ART,2,2021-01-22T09:48:31Z,2021-01-22T09:48:31Z
1YIqpPA9uV0,ITZY - 'NOT SHY' [ENGLISH VERSION] Lyrics [Color Coded_Eng],Ugx6vmEh-hv4UlTwEAh4AaABAg,"I needed a song like this from a girl group when I was constantly hearing boy groups being 'not shy', WOMEN AREN'T ALWAYS SHY!!! QUEEN <3",Oishani Bhattacharya,0,2021-01-25T07:29:03Z,2021-01-25T07:29:03Z
1YIqpPA9uV0,ITZY - 'NOT SHY' [ENGLISH VERSION] Lyrics [Color Coded_Eng],UgwSOSAsFf4wrXZp6WF4AaABAg,i didnt know not shy's lyrics was this bold but its good its great !!,you know soobin?,8,2021-01-22T07:49:41Z,2021-01-22T07:49:41Z
1YIqpPA9uV0,ITZY - 'NOT SHY' [ENGLISH VERSION] Lyrics [Color Coded_Eng],Ugykxiic20T1FsJQZht4AaABAg,Can we just agree that Lia's English is just amazing?,GamingWithLavy,12,2021-02-08T03:34:47Z,2021-02-08T03:34:47Z
1YIqpPA9uV0,ITZY - 'NOT SHY' [ENGLISH VERSION] Lyrics [Color Coded_Eng],UgzEaecdK5IxCbR1zwt4AaABAg,Now I can sing confidently in English 😆,lijay,3,2021-01-25T06:32:50Z,2021-01-25T06:32:50Z
1YIqpPA9uV0,ITZY - 'NOT SHY' [ENGLISH VERSION] Lyrics [Color Coded_Eng],Ugzf8NK3Oaa6ptbQLEB4AaABAg,This song is so addictive,Tyson,2,2021-03-11T23:42:18Z,2021-03-11T23:42:18Z
1YIqpPA9uV0,ITZY - 'NOT SHY' [ENGLISH VERSION] Lyrics [Color Coded_Eng],UgyMobknQCzh-Fw8-p54AaABAg,The Best English Version that I've heard through kpop,Xoxokaylz,4,2021-02-01T07:44:28Z,2021-02-01T07:44:28Z
1YIqpPA9uV0,ITZY - 'NOT SHY' [ENGLISH VERSION] Lyrics [Color Coded_Eng],UgwFtF8FfLI05YCr4ex4AaABAg,I'm so obsessed with Lia's diction😫💙,jezeunoia,23,2021-01-22T14:58:40Z,2021-01-22T14:58:40Z
1YIqpPA9uV0,ITZY - 'NOT SHY' [ENGLISH VERSION] Lyrics [Color Coded_Eng],UgyScbTAJodMCHYAoFZ4AaABAg,"Some parts sound really weird imo but some lines are awesome, I really like the pre-chorus for example.",s,1,2021-10-27T10:21:28Z,2021-10-27T10:21:28Z
1YIqpPA9uV0,ITZY - 'NOT SHY' [ENGLISH VERSION] Lyrics [Color Coded_Eng],UgxSO0DmcUWQcsqUJhl4AaABAg,I'm in love with the English version,jae,1,2021-01-22T08:03:33Z,2021-01-22T08:03:33Z
1YIqpPA9uV0,ITZY - 'NOT SHY' [ENGLISH VERSION] Lyrics [Color Coded_Eng],Ugz5xE_sEbdQnbbp51B4AaABAg,When the song start I start singing in Korean even if it is wrong and then realising it is English version 😂😂😂😳😳,yuvi king gaming,2,2021-10-03T10:14:41Z,2021-10-03T10:14:41Z
1YIqpPA9uV0,ITZY - 'NOT SHY' [ENGLISH VERSION] Lyrics [Color Coded_Eng],UgzMWwgzj6kyjGAK-FF4AaABAg,Lia sounds in amazing singing in English tho wow 🥰,LunarSpace,1,2021-01-22T16:11:42Z,2021-01-22T16:11:42Z
1YIqpPA9uV0,ITZY - 'NOT SHY' [ENGLISH VERSION] Lyrics [Color Coded_Eng],Ugz0xxdjh-dTmE7BuOp4AaABAg,I love it,Renice Eccles,2,2021-01-22T14:48:58Z,2021-01-22T14:48:58Z
1YIqpPA9uV0,ITZY - 'NOT SHY' [ENGLISH VERSION] Lyrics [Color Coded_Eng],UgxC78gMQ6sl-7Igk6B4AaABAg,Yuna's parts are so on point!,runamitchie,0,2021-01-22T19:19:46Z,2021-01-22T19:19:52Z
1YIqpPA9uV0,ITZY - 'NOT SHY' [ENGLISH VERSION] Lyrics [Color Coded_Eng],UgxpbzvMrJ1jEKFLxvB4AaABAg,I found it on zepeto and I am satisfied with this song 👍👍👍,Ppraveen Kumar,1,2021-02-02T11:06:36Z,2021-02-02T11:06:36Z
1YIqpPA9uV0,ITZY - 'NOT SHY' [ENGLISH VERSION] Lyrics [Color Coded_Eng],UgxrUEc6ZwtUj8_GW354AaABAg,"Hey there hey there it's just so cool yeji, s voice",Vanessa Iva Gulmayo,1,2021-02-01T10:29:12Z,2021-02-01T10:29:12Z
1YIqpPA9uV0,ITZY - 'NOT SHY' [ENGLISH VERSION] Lyrics [Color Coded_Eng],UgzXmJ_QtIJulR20DoJ4AaABAg,Damnn....I love Yeji's part😍,Evil San'i & Yeji eYeS,0,2021-02-21T04:45:27Z,2021-02-21T04:45:27Z
1YIqpPA9uV0,ITZY - 'NOT SHY' [ENGLISH VERSION] Lyrics [Color Coded_Eng],UgwynTFN19d_4unhz5l4AaABAg,"Ok this is definitely the best one. The others are good but very straight forward, this one sounds really natural in english. I think because they used slang and metaphors here.",Amelia Rose,13,2021-01-22T15:03:26Z,2021-01-22T15:03:26Z
1YIqpPA9uV0,ITZY - 'NOT SHY' [ENGLISH VERSION] Lyrics [Color Coded_Eng],UgyDBIz-ZjGw1IJTMOJ4AaABAg,"when lia started singing 
me: dang girl you made it😌",hwang hates your behavior ugh,5,2021-01-23T00:51:25Z,2021-01-23T00:51:25Z
1YIqpPA9uV0,ITZY - 'NOT SHY' [ENGLISH VERSION] Lyrics [Color Coded_Eng],UgwSceIKPFjMk6tGoGh4AaABAg,"This is 💜👌👌👌💜 but if I would write the song, I'd put something like ""Won't let you go, cuz you know, that I'm Not Shy"" for the chorus uwu",Chaeyoung is oPpAr,0,2021-01-22T10:58:47Z,2021-01-22T10:58:47Z
1YIqpPA9uV0,ITZY - 'NOT SHY' [ENGLISH VERSION] Lyrics [Color Coded_Eng],Ugxs8b2Hnmj8Itx63994AaABAg,Lia’s voice here is insane,Xxxx Xxx,0,2021-01-23T03:34:13Z,2021-01-23T03:34:13Z
1YIqpPA9uV0,ITZY - 'NOT SHY' [ENGLISH VERSION] Lyrics [Color Coded_Eng],Ugwh0G2yE0emETgpUgF4AaABAg,"For being groups with only one fluent English speaking member, so far CLC and ITZY make the best English covers imo",jasmine,0,2021-01-24T03:26:13Z,2021-01-24T03:26:13Z
1YIqpPA9uV0,ITZY - 'NOT SHY' [ENGLISH VERSION] Lyrics [Color Coded_Eng],UgwIG6rD4yyJ7MBazgF4AaABAg,ITZY GOT THE LYRICS!!!!!!!!,itsshubh2,2,2021-01-25T21:24:56Z,2021-01-25T21:24:56Z
1YIqpPA9uV0,ITZY - 'NOT SHY' [ENGLISH VERSION] Lyrics [Color Coded_Eng],Ugy37EqfmZxhnR08SQR4AaABAg,Ay Lee Minho ay Lee minhoo is iconic af😂😂💜💜😭😭,gul mohammad,66,2021-01-22T06:22:40Z,2021-01-22T06:22:40Z
1YIqpPA9uV0,ITZY - 'NOT SHY' [ENGLISH VERSION] Lyrics [Color Coded_Eng],UgzmNLCJU7zyRyKHBvB4AaABAg,I like lia's english. She improved a lot,Adeptus Keqing,3,2021-02-05T12:41:58Z,2021-02-05T12:41:58Z
1YIqpPA9uV0,ITZY - 'NOT SHY' [ENGLISH VERSION] Lyrics [Color Coded_Eng],UgzRdKrqdxKn-hTKTMx4AaABAg,"im gonna do my best not to giggle at the lee minho comments
but this eng vers is actually pretty good, not too much of just an english translate of the original except for the ""malhaebwada eoseoda cuz im not shy"" not being there😔",clcneedsalightstick,0,2021-01-23T03:44:51Z,2021-01-23T03:44:51Z
1YIqpPA9uV0,ITZY - 'NOT SHY' [ENGLISH VERSION] Lyrics [Color Coded_Eng],UgyzzLYhWKUY5b8FaLF4AaABAg,lia NAILED her first verse.,pearl a.,75,2021-01-22T08:34:12Z,2021-01-22T08:34:12Z
1YIqpPA9uV0,ITZY - 'NOT SHY' [ENGLISH VERSION] Lyrics [Color Coded_Eng],UgyL9ceJkvJuh77uI7J4AaABAg,chaeryeong's zepeto character is so pretty wow :0,Huda Musyirah 후다 문,47,2021-01-22T08:07:12Z,2021-01-22T08:07:12Z
1YIqpPA9uV0,ITZY - 'NOT SHY' [ENGLISH VERSION] Lyrics [Color Coded_Eng],Ugyl41NuLQBOOI4hn0N4AaABAg,Finallyyy I can sing this song!,Estefanía Santiago,0,2021-02-01T01:21:48Z,2021-02-01T01:21:48Z
1YIqpPA9uV0,ITZY - 'NOT SHY' [ENGLISH VERSION] Lyrics [Color Coded_Eng],Ugz6AL-JMwp9_V0H3C54AaABAg,OMG . Itzy girls speaking English is bomb 😫✨,Midnight MoonProductions,2,2021-01-22T11:49:23Z,2021-01-22T11:49:23Z
1YIqpPA9uV0,ITZY - 'NOT SHY' [ENGLISH VERSION] Lyrics [Color Coded_Eng],Ugy2gQ1UEkaZGpZVuRF4AaABAg,"[West]
Not shy Not me

[Kaeden]
ITZY

[Karsen]
I'm down so if you're down 

[Kreayon]
Yeah

[Koe]
Not shy Not me
--
[Kaeden]
Nobody, body ever got in the way of something I truly wanted
Cuz I don't waste time, I dive right in

[Westyn]
Yeah Imma take it if I like it, if I like it, like it

[Karsen]
Straight out the gate, no I don't wanna wait
Cuz the word 'hesitate' ain't a part of my game, yeah
Take a shot, take it pow pow pow pow pow

[Koe]
Not shy to say I want you

[Kiyo]
Hey there, hey there
We make a great pair, great pair
You know that if I could make you my own
I could show you things you never dreamed of

[Kaeden]
Yeah, yeah
Why don't you wake up, follow the signs
You're a free agent, do what you like
But I'm impatient, swallow your pride

[Kreayon]
And let me know, let me know, cuz I'm not shy

[Westyn]
Not shy Not me 

[Kaeden]
ITZY

[Karsen]
I'm down so if you're down, not shy

[Kiyo]
Not shy Not me

[Koe]
Tell me now if you're d-d-d-d-down

[Westyn]
Not shy Not me 

[Kaeden]
ITZY

[Karsen]
I'm down so if you're down, not shy

[Kiyo]
Not shy Not me

[Kreayon]
You're what I want, what I want
And I'm not shy

[Kaeden]
Nobody, body need to ask if you got it bad
Cuz I see right through you woo

[Westyn]
You gotta keep your eyes on the prize
Yeah you will like it, cuz you like it, cuz you like it, like it

[Karsen]
Gotta step up, boy you're thinking too much
Forget everything else, cuz I'm the only one, yeah
Clear your mind, clear it now now now now now

[Koe]
Not shy to say I want you

[Kiyo]
Hey there, hey there
We make a great pair, great pair
You know that if I could make you my own
I could show you things you never dreamed of

[Kaeden]
Yeah yeah
Why don't you wake up, follow the signs
You're a free agent, do what you like
But I'm impatient, swallow your pride

[Kreayon]
And let me know, let me know, cuz I'm not shy

[Westyn]
Not shy Not me 

[Kaeden]
ITZY

[Karsen]
I'm down so if you're down, not shy

[Kiyo]
Not shy Not me

[Koe]
Tell me now if you're d-d-d-d-down

[Westyn]
Not shy Not me 

[Kaeden]
ITZY

[Karsen]
I'm down so if you're down, not shy

[Kiyo]
Not shy Not me

[Kreayon]
You're what I want, what I want
And I'm not shy

[Karsen]
I don't wanna overthink it
Don't wanna have any regrets
Go go go it's your turn tonight
No yes no either way it's fine

[Kaeden]
Yeah, baby no messing me around
All we can do is see how it plays out
Let's just be who we are
Do what we do
We go with the flow

[Kreayon]
Let the beat drop
---
[Koe]
Not shy Not me 

[Kaeden]
ITZY

[Koe]
I'm down so if you're down, not shy

[Kiyo]
Not shy Not me
So let me know, let me know coz I'm not shy.

[Westyn]
Not shy Not me 

[Kaeden]
ITZY

[Karsen]
I'm down so if you're down, not shy

[Kiyo]
Not shy Not me

[Kreayon]
You're what I want, what I want
And I'm not shy

[All]
NOT SHY NOT ME.",Cyntheria Boa Frostella,0,2022-03-29T03:57:17Z,2022-03-29T03:57:17Z
1YIqpPA9uV0,ITZY - 'NOT SHY' [ENGLISH VERSION] Lyrics [Color Coded_Eng],Ugxafk0UjQAzSAeQHnR4AaABAg,I'm obsessed with Lia's deep voice,Fairytopia,0,2021-02-07T16:02:37Z,2021-02-07T16:02:37Z
1YIqpPA9uV0,ITZY - 'NOT SHY' [ENGLISH VERSION] Lyrics [Color Coded_Eng],UgzSwiGySpLyFg1J5zR4AaABAg,cuz the word hesitate aint a part of my game” its just brilliant,PURPLE KOVERS,2,2021-01-22T13:34:07Z,2021-01-22T13:34:07Z
1YIqpPA9uV0,ITZY - 'NOT SHY' [ENGLISH VERSION] Lyrics [Color Coded_Eng],UgzGF-SAn50c-FZzp8B4AaABAg,"yuna sounds great, her english is so cute! :)<3",boombayuna,2,2021-01-22T11:23:44Z,2021-01-22T11:23:44Z
1YIqpPA9uV0,ITZY - 'NOT SHY' [ENGLISH VERSION] Lyrics [Color Coded_Eng],UgwCJvXN45SDJ-2wA554AaABAg,"Honestly, ""I'm down if you're down"" really hit.",maddiy w,3,2021-01-22T21:52:43Z,2021-01-22T21:52:43Z
1YIqpPA9uV0,ITZY - 'NOT SHY' [ENGLISH VERSION] Lyrics [Color Coded_Eng],UgwVi0h7G1MHCKqXNWJ4AaABAg,"Out of 100% eng ver.
1. DALLA - 80%
2. ICY - 70%
3. Wannabe - 75% (worked because the song utilizes ITZY's vocal 100%)
4. Not Shy -  80% (worked because the song utilizes ITZY's vocal 100%, but some parts are out of place)",Mans 567,1,2023-03-21T16:45:20Z,2023-03-21T16:45:45Z
1YIqpPA9uV0,ITZY - 'NOT SHY' [ENGLISH VERSION] Lyrics [Color Coded_Eng],UgzCu7_J9Ry7vPRltgl4AaABAg,"This version really shows off Lia's vocals, I'm just saying. And anyone who disagrees is deaf",Evie-Mae,41,2021-01-22T21:33:57Z,2021-01-26T18:06:31Z
1YIqpPA9uV0,ITZY - 'NOT SHY' [ENGLISH VERSION] Lyrics [Color Coded_Eng],UgwfYFTBcHGPmMIi-Kl4AaABAg,2:17 my. Favorite part of the song!!!,GamersA&S,2,2021-01-29T11:47:47Z,2021-01-29T11:47:47Z
1YIqpPA9uV0,ITZY - 'NOT SHY' [ENGLISH VERSION] Lyrics [Color Coded_Eng],UgyK_dbz7LfAVW6zoEJ4AaABAg,Their english is ✨perfect✨,Malia Tale,0,2021-01-28T19:41:25Z,2021-01-28T19:41:25Z
1YIqpPA9uV0,ITZY - 'NOT SHY' [ENGLISH VERSION] Lyrics [Color Coded_Eng],UgwZ81AfKRDfzK184ZJ4AaABAg,"""Yeah imma take it if i like it, if i like it, like it"" 💯 get it girls😘",TheRoseofNCT,2,2021-01-22T19:31:27Z,2021-01-22T19:31:27Z
1YIqpPA9uV0,ITZY - 'NOT SHY' [ENGLISH VERSION] Lyrics [Color Coded_Eng],UgxI63R1M2-5QbdCdNh4AaABAg,OMG MY MIND GETS STUCK ON LIA'S LINES,deji,1,2021-01-22T14:47:39Z,2021-01-22T14:47:39Z
1YIqpPA9uV0,ITZY - 'NOT SHY' [ENGLISH VERSION] Lyrics [Color Coded_Eng],UgzN-YvAVWG4aa_idMF4AaABAg,Itzy's what we want and we're not shy.,Joe McCullar,0,2022-09-04T03:02:21Z,2022-09-04T03:02:21Z
1YIqpPA9uV0,ITZY - 'NOT SHY' [ENGLISH VERSION] Lyrics [Color Coded_Eng],Ugws1LWSaqGKRAML4a14AaABAg,Jesus Christ man this is amazing,VergilEdits,2,2021-03-05T22:28:42Z,2021-03-05T22:28:42Z
1YIqpPA9uV0,ITZY - 'NOT SHY' [ENGLISH VERSION] Lyrics [Color Coded_Eng],UgxHOQXGisLhTnkiGdt4AaABAg,Yeji is gorgeous. Even in Zepeto,Trey Cary,2,2021-01-22T15:47:24Z,2021-01-22T15:47:24Z
1YIqpPA9uV0,ITZY - 'NOT SHY' [ENGLISH VERSION] Lyrics [Color Coded_Eng],Ugyiyrlb37dSTxLrNn54AaABAg,Lia reina del inglés uwu,cam★.,0,2021-01-24T10:10:44Z,2021-01-24T10:10:44Z
1YIqpPA9uV0,ITZY - 'NOT SHY' [ENGLISH VERSION] Lyrics [Color Coded_Eng],Ugw5zZrkiYVdWV09w814AaABAg,"Hey lee Minho Lee Minho Cause i'm Not shy
 *JISUNG HAS LEFT THE CHAT*
😂😂😂",Itzy Lia's cUCuMBeR tAsTe LiKe eLeCtRiCiTy,863,2021-01-22T05:46:46Z,2021-01-22T05:46:46Z
1YIqpPA9uV0,ITZY - 'NOT SHY' [ENGLISH VERSION] Lyrics [Color Coded_Eng],UgxaSz_AjvcjNYbpaLh4AaABAg,Itzy's english took my heart,Nurunnahar Mazumder,0,2021-03-02T11:36:46Z,2021-03-02T11:36:46Z
1YIqpPA9uV0,ITZY - 'NOT SHY' [ENGLISH VERSION] Lyrics [Color Coded_Eng],UgySHINHYJWcHfZUtiN4AaABAg,"This is legendary line ""Hey! Lemme know, Lemme know cu'z I'm not shy""",sunoo_hndsm,5,2021-01-22T13:44:07Z,2021-01-22T13:44:07Z
1YIqpPA9uV0,ITZY - 'NOT SHY' [ENGLISH VERSION] Lyrics [Color Coded_Eng],UgxFZHhVusaj9o6GcsZ4AaABAg,Even tho this is the english version I still sing the Korean version.,Vilma Antonio,1,2021-03-26T14:11:15Z,2021-03-26T14:11:15Z
