videoId,title,parentId,textDisplay,authorChannelId,authorDisplayName,likeCount,publishedAt,updatedAt
bMSkW8byD3k,"ITZY (있지) ""WANNABE"" (Color Coded Lyrics Eng/Rom/Han/가사)",UgyKiNFhqEitf7GxKmR4AaABAg,"""I'd rather be selfish a hundred times than being hurt pretending to be nice""

That line really spoke to me. This song is such a bop. Everyone blew my wig away. Ryujin and Yeji killed me. I love this song.",UCfiab1-AcD35uauBnLSoYdQ,西宮shion,4200,2020-03-11T08:36:55Z,2020-03-11T08:36:55Z
bMSkW8byD3k,"ITZY (있지) ""WANNABE"" (Color Coded Lyrics Eng/Rom/Han/가사)",UgxLCPAm4ugSVUTIkip4AaABAg,"am i the only one imagining the shoulder dance? you CANNOT listen to this song without thinking of that iconic move. :))

edit: damn",UCBjUean58mENU1-K1OQ0bOg,MG Legaspi,11685,2020-03-27T13:32:26Z,2023-02-03T21:52:07Z
bMSkW8byD3k,"ITZY (있지) ""WANNABE"" (Color Coded Lyrics Eng/Rom/Han/가사)",UgwgnU2-YQ_RXGpp8aZ4AaABAg,"*I am not a fan of Itzy.*
*I don't listen to Kpop.*
*But this is,*
*True Art.*",UCVUsf5o3zywD5UkG3OikAfA,Nazia Khan,3770,2020-05-03T15:44:12Z,2020-05-03T15:44:12Z
bMSkW8byD3k,"ITZY (있지) ""WANNABE"" (Color Coded Lyrics Eng/Rom/Han/가사)",UgysWtp0Dirt-PKUwdJ4AaABAg,"Itzy isn't like other groups, they don't follow a crush, cute, badass image they are iconic, they deserve more, they're songs are so meaningful.",UC8nnLy3sRX2pifrKi6FT72w,Mirna Guix,2,2023-10-19T15:24:18Z,2023-10-19T15:24:18Z
bMSkW8byD3k,"ITZY (있지) ""WANNABE"" (Color Coded Lyrics Eng/Rom/Han/가사)",UgzzXZGtWtZ9eqG7RPN4AaABAg,"i love how there songs is not about love , there songs really have special meanings ❤️ protect itzy at all cost",UC6GRWaZpKYBnwmPCNzyGT-w,s,640,2020-05-19T12:54:32Z,2020-05-19T12:54:49Z
bMSkW8byD3k,"ITZY (있지) ""WANNABE"" (Color Coded Lyrics Eng/Rom/Han/가사)",Ugxz-FFL2XLhCzaS5Xx4AaABAg,im an idiot for not following this group sooner. so fucking good.,UCSDnfb6y5-sn3a-2-y_fm-g,dang,217,2022-12-03T13:21:25Z,2022-12-03T13:21:25Z
bMSkW8byD3k,"ITZY (있지) ""WANNABE"" (Color Coded Lyrics Eng/Rom/Han/가사)",UgweQJpjbVYJDlGiSwR4AaABAg,"*The beats are catchy.*
*Their voices are awesome*

*I'm addicted to this. ITZY killed it !*",UCIvFfQTFdZ9lFIU9Q0Sc4oQ,Hey StOb it,2060,2020-03-09T09:46:31Z,2020-03-09T09:46:31Z
bMSkW8byD3k,"ITZY (있지) ""WANNABE"" (Color Coded Lyrics Eng/Rom/Han/가사)",UgyidHIaHamx1eIppnt4AaABAg,"""People love to talk about others. Why do you care so much about other peoples lives?""  STRAIGHT FACTS
this song empowers me so much, not only the lyrics, but the catchy beats and also the cool choreography.  I love itzy ❤",UChIdZCue6E4hiQQOIH1a5Lw,DiamondSaf,263,2020-04-11T22:20:54Z,2020-04-11T22:20:54Z
bMSkW8byD3k,"ITZY (있지) ""WANNABE"" (Color Coded Lyrics Eng/Rom/Han/가사)",Ugxh0sqQgPRzoOnfPNt4AaABAg,I love how ITZY's song is about self confidence and most of them are not about love :)),UCjeteeMTaOs5s5477SdTTbg,meikos,354,2020-04-23T09:29:42Z,2020-04-24T01:50:28Z
bMSkW8byD3k,"ITZY (있지) ""WANNABE"" (Color Coded Lyrics Eng/Rom/Han/가사)",Ugx1XSdI1XJb91FRZ_J4AaABAg,"Dalla Dalla :- Yeji's Era
Icy :- Yuna's Era
Wannabe :- Ryunjin's Era
Not shy :- Lia's Era
Next comeback :- Chaeryeong's Era",UCIQLPF-Z4BNqDkZIZMAiI4w,Bangpink domination,3712,2020-10-16T06:27:30Z,2020-10-16T06:27:30Z
bMSkW8byD3k,"ITZY (있지) ""WANNABE"" (Color Coded Lyrics Eng/Rom/Han/가사)",UgwJoKXcHTD0qrTX14F4AaABAg,One thing I like about ITZY is their lyrics. They r relatable and bring so much confidence,UCNsGsuaNe7EK_u8bq2Z66xw,Bhavyasri Suggula,52,2020-03-26T15:55:00Z,2020-03-26T15:55:00Z
bMSkW8byD3k,"ITZY (있지) ""WANNABE"" (Color Coded Lyrics Eng/Rom/Han/가사)",Ugxe1llcH5rq-WS-mXd4AaABAg,"I'm amaze to them because they promote confidence to their main track, It help many people to move forward with no hesitation and boost confindence. For me, they are unique girl group. 🙂",UChOlq5Y4Cb9QDYTNpCwfbYA,KPOPJ Wanderer,49,2020-07-30T15:29:07Z,2020-07-30T15:29:43Z
bMSkW8byD3k,"ITZY (있지) ""WANNABE"" (Color Coded Lyrics Eng/Rom/Han/가사)",UgxJW2CXiXRPyTIrWOV4AaABAg,"DALLA DALLA : YEJI'S ERA
ICY : YUNA'S ERA
WANNABE : RYUJIN'S ERA

CANT WAIT FOR CHAERYEONG AND LIA 💜",UCALXrbPGUAuaF_4UBa4d4Ow,Yvonne,9684,2020-03-09T11:26:14Z,2020-03-09T11:26:14Z
bMSkW8byD3k,"ITZY (있지) ""WANNABE"" (Color Coded Lyrics Eng/Rom/Han/가사)",UgzxI69y-hhFJdfFVid4AaABAg,I love how ITZY's title tracks are all about self love and being confident about yourself 💕💕,UCnAaPXgXhBKhWmneohSGF0w,satoru on crack,29,2020-04-02T04:17:32Z,2020-04-02T04:17:32Z
bMSkW8byD3k,"ITZY (있지) ""WANNABE"" (Color Coded Lyrics Eng/Rom/Han/가사)",UgyUo0lFnLgNJVf0MbB4AaABAg,"Ryujin’s voice really stands out to me, I really love her vocals",UCZ1ULJoMxqQj63wplIJ065g,Jizzzzzzzzzzzzzzbread,35,2020-10-31T03:44:28Z,2020-10-31T03:44:28Z
bMSkW8byD3k,"ITZY (있지) ""WANNABE"" (Color Coded Lyrics Eng/Rom/Han/가사)",UgwcXXT_PSPe7fO3bXB4AaABAg,All yeji's lines are soo addicting😭💖,UC9XPQog_xr99iIZ7B0WdmMA,bass,50,2021-07-29T14:32:18Z,2021-07-29T14:32:18Z
bMSkW8byD3k,"ITZY (있지) ""WANNABE"" (Color Coded Lyrics Eng/Rom/Han/가사)",UgxdfFt24JqvvVXtaF14AaABAg,This song made me a MIDZY. I really am so in love with this song. It makes me feel happy with myself and who I am. Makes me so confident 😭🤍,UCMQzI0IEOVpvE7FRnJU8SKg,Queniline Lauron,35,2022-06-22T09:31:18Z,2022-06-22T09:31:18Z
bMSkW8byD3k,"ITZY (있지) ""WANNABE"" (Color Coded Lyrics Eng/Rom/Han/가사)",UgxO-_OBtQW0sRT7JXV4AaABAg,"nossa eu viciei nessa musica, ela é boa demais
""I Wannabe be me, me, me''",UCNWg_gk6e4fzFOhbYFbhZZA,Mochi JPark,26,2022-03-10T15:34:32Z,2022-03-10T15:34:32Z
bMSkW8byD3k,"ITZY (있지) ""WANNABE"" (Color Coded Lyrics Eng/Rom/Han/가사)",UgwipPt6jw14f8fqqkt4AaABAg,"Everyone: Give Ryujin more lines
JYP: As you wish!",UC0f5KmpPDwCiY-ZcpXumQ6g,Set Me Free,11829,2020-03-09T09:55:23Z,2020-03-09T09:55:23Z
bMSkW8byD3k,"ITZY (있지) ""WANNABE"" (Color Coded Lyrics Eng/Rom/Han/가사)",UgweWBO5XK19rAhFikB4AaABAg,"this song is such a bop omg 
i’m new to itzy so i don’t really know the members to much but like SIS THEY SO TALENTED",UCSp9Bz0hK5AYyohlhb6bK-w,Belen Gonzalez,67,2020-07-23T01:26:30Z,2020-07-23T01:26:30Z
bMSkW8byD3k,"ITZY (있지) ""WANNABE"" (Color Coded Lyrics Eng/Rom/Han/가사)",UgxVmJlalGcc97OuhCN4AaABAg,i LOVE ITZY THEY ARE AMAZING SO GOOD,UChAo2ZjMAGx6uZaLgI6v2vA,Michelle the Softball girl,18,2023-01-25T00:56:14Z,2023-01-25T00:56:14Z
bMSkW8byD3k,"ITZY (있지) ""WANNABE"" (Color Coded Lyrics Eng/Rom/Han/가사)",UgxJkBNMUk68npFX8Oh4AaABAg,"The lyrics are amazing, I appreciate the song so much more now.",UCnIKNPt2BQj_nWWKHDXvz0w,Alright Cool,19,2020-12-13T16:18:58Z,2020-12-13T16:18:58Z
bMSkW8byD3k,"ITZY (있지) ""WANNABE"" (Color Coded Lyrics Eng/Rom/Han/가사)",Ugw5V98SnqnLJYk7MVl4AaABAg,"anyone else love how empowering (i think thats the word) itzy’s lyrics can be? like dalla dalla is being its okay to be different (if i remember correctly) icy is, inspiring in a way because they worked hard and are getting what they want, and wannabe is about being yourself, and not worrying about others. i love itzy!",UCS5u1V3v7ShF2xeAojq8IDA,gachakat,18,2020-03-26T21:04:16Z,2020-03-26T21:04:16Z
bMSkW8byD3k,"ITZY (있지) ""WANNABE"" (Color Coded Lyrics Eng/Rom/Han/가사)",Ugz308p_I_mwT-JAWYJ4AaABAg,"THE VOCAL
THE RAP
THE VISUAL
THE DANCE 
THE LYRICS 
THE EVERYTHING 😍😭🩷🫶🏻💫",UCPCSgMl5ziI8eyaC2ISHa4g,aesthetix💌hd,11,2023-06-13T15:21:07Z,2023-06-13T15:21:07Z
bMSkW8byD3k,"ITZY (있지) ""WANNABE"" (Color Coded Lyrics Eng/Rom/Han/가사)",Ugzr_V7p6vxNolaoJrh4AaABAg,"1:50, i don't know why i really like lia's line",UCyudU7IG-Lr-D09AhPbkZCg,falquixote,1231,2020-03-09T09:42:23Z,2020-04-09T11:04:13Z
bMSkW8byD3k,"ITZY (있지) ""WANNABE"" (Color Coded Lyrics Eng/Rom/Han/가사)",Ugxt3k9WeyfddDzFZmF4AaABAg,I LOVE how all there songs are so influencing and how they love to be there selfs. love them,UCv_8RTUl977qxoRmsfxiFmw,JourJour 67,16,2020-03-25T22:36:42Z,2020-03-25T22:36:42Z
bMSkW8byD3k,"ITZY (있지) ""WANNABE"" (Color Coded Lyrics Eng/Rom/Han/가사)",UgzXwW4GDFQT5lnmiSh4AaABAg,0:15-0:33 is so catchy I keep replaying it at full volume,UCFCMQ0vTQNd_LPWgR8U6cdQ,Eližabëth,14,2020-03-31T04:08:19Z,2020-03-31T04:08:19Z
bMSkW8byD3k,"ITZY (있지) ""WANNABE"" (Color Coded Lyrics Eng/Rom/Han/가사)",UgyhIXY6fyj6l6dldzp4AaABAg,Literally every ITZY song is so catchy like whaaat?,UC6Lo_AD9smnmvJYRRV7IFBw,Aera,97,2020-11-17T11:03:13Z,2020-11-17T11:03:13Z
bMSkW8byD3k,"ITZY (있지) ""WANNABE"" (Color Coded Lyrics Eng/Rom/Han/가사)",UgwGxWsSVPlhqGsf_td4AaABAg,I cannot believe they debuted last year!! the whole vibe of each song they make is truly unique and incredible. they all deserve so much more recognition for what they sing and dance to. The girls have outdone themselves.,UCb3YdQwPr-2K-UfdJjVL4iA,smokinghotimmigrant,2,2020-03-31T08:40:11Z,2020-03-31T08:40:11Z
bMSkW8byD3k,"ITZY (있지) ""WANNABE"" (Color Coded Lyrics Eng/Rom/Han/가사)",UgwlSj1qbsqUItllS9x4AaABAg,I love how this group splits the vocals up and almost every 2 lines or so somebody new starts to sing. Its done really well,UCgqrA4rFvY0NpaCbXFQq2NQ,LastGreg,13,2020-10-06T23:14:55Z,2020-10-06T23:14:55Z
bMSkW8byD3k,"ITZY (있지) ""WANNABE"" (Color Coded Lyrics Eng/Rom/Han/가사)",Ugx6i6COV-3Qib_9QQZ4AaABAg,"I feel like they are going to be one of the inspiring artists in future . Their songs are so powerful and meaningful . 
In Dalla dalla they sang about being different , in Icy they sang that they don't care about their appearance . And in this song they are singing about being themselves . Ooof i love them sm 😭",UCf4hf1HE7W58QtSa17fSfaQ,apple,300,2020-03-09T09:43:12Z,2020-03-09T09:43:49Z
bMSkW8byD3k,"ITZY (있지) ""WANNABE"" (Color Coded Lyrics Eng/Rom/Han/가사)",UgwKLZ4wmDQXX9uLYi94AaABAg,Argghhhh JYP are so good at producing catchy songs! I'm jealous,UChgzIL-d9g7qaNYNVzh-55Q,MISS WHODa,21,2020-06-27T15:37:00Z,2020-06-27T15:37:00Z
bMSkW8byD3k,"ITZY (있지) ""WANNABE"" (Color Coded Lyrics Eng/Rom/Han/가사)",UgxTDX5Jz0y7w_qQ_L54AaABAg,"I'm crying to this song.. Cuz I find myself hating my own self again and again. But this song telling me to love and just be myself, being confident.. This is what I need in life",UChgzIL-d9g7qaNYNVzh-55Q,MISS WHODa,37,2021-11-23T04:34:37Z,2021-11-23T04:34:37Z
bMSkW8byD3k,"ITZY (있지) ""WANNABE"" (Color Coded Lyrics Eng/Rom/Han/가사)",UgzJRp6vKcFt22QGflJ4AaABAg,suka banget sama arti nya❤,UCxzbmmZ6JVx1aDt6sLgOFTQ,Boys Indo,1,2023-08-09T10:59:26Z,2023-08-09T10:59:26Z
bMSkW8byD3k,"ITZY (있지) ""WANNABE"" (Color Coded Lyrics Eng/Rom/Han/가사)",UgyAkM0FbvxBA_ljSaJ4AaABAg,"""it's none of your business, I do my own business"" is literally my motto through life, this lyric is the reason why I like this song",UCyIbYNVZrcw2MoHizqq5SkA,superRookie,10,2020-04-25T10:43:35Z,2020-04-25T10:43:35Z
bMSkW8byD3k,"ITZY (있지) ""WANNABE"" (Color Coded Lyrics Eng/Rom/Han/가사)",UgwtXVQuvc7QijDpr1B4AaABAg,I really love the lyrics personally because they resonate with me ❤️,UCIriATgUTk6yZEhLoG_PR9w,Pizazzy Snazzy,5,2020-07-27T01:00:01Z,2020-07-27T01:00:01Z
bMSkW8byD3k,"ITZY (있지) ""WANNABE"" (Color Coded Lyrics Eng/Rom/Han/가사)",Ugxrdvol7NBYzZP1-zZ4AaABAg,"_""People like to talk about other people , why are there so interesred in other people's lives ?""_
This is probably the most relatable line in this song . I've always seen many people actually caring about other's lives more than their own . Whereas they should just mind their own business . Telling others to do this and that . And i'm saying this from a personal experience .",UCf4hf1HE7W58QtSa17fSfaQ,apple,7885,2020-03-09T09:47:45Z,2020-03-09T09:47:45Z
bMSkW8byD3k,"ITZY (있지) ""WANNABE"" (Color Coded Lyrics Eng/Rom/Han/가사)",Ugys4cvS8JAgFcnBs_J4AaABAg,"MIDZY: Give Ryujin more lines!
JYP: **gives Ryujin more lines**

ONCE: Give Chaeyoung more lines!
JYP: *nO*",UCIuEc-5kjT-xabui6LfdwSw,shiny ryujin,2149,2020-03-23T12:01:37Z,2020-03-23T12:01:37Z
bMSkW8byD3k,"ITZY (있지) ""WANNABE"" (Color Coded Lyrics Eng/Rom/Han/가사)",UgwNYl3D091Ev1bQ0Yd4AaABAg,I freaking love this song...  It's so inspiring,UChgzIL-d9g7qaNYNVzh-55Q,MISS WHODa,6,2020-11-17T07:20:15Z,2020-11-17T07:20:15Z
bMSkW8byD3k,"ITZY (있지) ""WANNABE"" (Color Coded Lyrics Eng/Rom/Han/가사)",UgzhVZS9qSujXmeEoOh4AaABAg,The lyrics 👏🏻👏🏻🔥🔥,UCPU3HaNQqc-8uivYDR9HS8A,Adela Mirto,23,2021-05-01T03:25:54Z,2021-05-01T03:25:54Z
bMSkW8byD3k,"ITZY (있지) ""WANNABE"" (Color Coded Lyrics Eng/Rom/Han/가사)",UgzvatSJllKZcfYtDyl4AaABAg,Honestly they're improving so fast. This song and the whole comeback is a great one. I loved it more than Dalla Dalla and Icy combined. This is just so amazing amd their vocals are on goddamn point,UCgxeoC6zMIJtDTKIvH9SDrA,Blake Dora,5,2020-03-20T10:57:07Z,2020-03-20T10:57:07Z
bMSkW8byD3k,"ITZY (있지) ""WANNABE"" (Color Coded Lyrics Eng/Rom/Han/가사)",Ugy2IpnGoKniDjUnIDp4AaABAg,*I'm not a big fan of ITZY but I love this song*,UCbP-diOEMZtqGJLtzK9pwng,;Luzbeth-idk,10,2020-11-24T03:39:00Z,2020-11-24T03:39:00Z
bMSkW8byD3k,"ITZY (있지) ""WANNABE"" (Color Coded Lyrics Eng/Rom/Han/가사)",UgwaumXF1WlYsaaJjrN4AaABAg,"IT’Z DIFFERENT : YEJI🤍
IT’Z ICY : YUNA💛
IT’Z ME : RYUJIN 💙",UCO7_3-O0gu-mVangWlu8gwA,breadhyeon,5601,2020-03-09T09:40:34Z,2020-03-09T09:40:34Z
bMSkW8byD3k,"ITZY (있지) ""WANNABE"" (Color Coded Lyrics Eng/Rom/Han/가사)",UgwPqJkbaiDAVd_M_zh4AaABAg,Yeji's part at 1:38 has got to be the most beautiful sound I've even heard.,UCUf3ElLqxKcMUdIZoIkbEEA,Jon Snow Pro Gaming,8,2020-04-21T11:29:21Z,2020-04-21T11:29:21Z
bMSkW8byD3k,"ITZY (있지) ""WANNABE"" (Color Coded Lyrics Eng/Rom/Han/가사)",Ugz9vm_B_JeLP6XnQpJ4AaABAg,"I’m in love with this song, especially with this 2:15 Ryujin line",UCGkpXxUiccMmUEvurCDcZ7w,Martyna,10,2020-03-19T20:43:24Z,2020-03-19T20:43:24Z
bMSkW8byD3k,"ITZY (있지) ""WANNABE"" (Color Coded Lyrics Eng/Rom/Han/가사)",Ugzy1pOlc1agVxR7Ixh4AaABAg,This is such a great song I keep singing it to the point I want to hear the music,UCYm81zymYttDznTWe88I_Zg,April <3,3,2021-11-27T19:30:00Z,2021-11-27T19:30:00Z
bMSkW8byD3k,"ITZY (있지) ""WANNABE"" (Color Coded Lyrics Eng/Rom/Han/가사)",UgwM2b5rhxpbvSgGpOh4AaABAg,I LOVE LIA’S VOCALS 💖 💕,UCv6yL3j3AkZjUZ7NZylUmyQ,초초,4,2020-05-18T12:59:36Z,2020-05-18T12:59:36Z
bMSkW8byD3k,"ITZY (있지) ""WANNABE"" (Color Coded Lyrics Eng/Rom/Han/가사)",Ugzf96lYNMN-6Lj9jf94AaABAg,"My head can’t stop replaying


""i wanna be me, me ,me """,UClJlel_qXG0P8mPfHOGB5rg,Yourdailykoo,1076,2020-03-09T10:13:02Z,2020-03-09T10:13:02Z
bMSkW8byD3k,"ITZY (있지) ""WANNABE"" (Color Coded Lyrics Eng/Rom/Han/가사)",Ugz3jXR6GXcb5Co7gph4AaABAg,ITZY never disappoints! This is SUCH a bop!,UCU1BeWg-CBWPaiDoj6s4OOw,behijabi,0,2020-03-23T16:35:53Z,2020-03-23T16:35:53Z
bMSkW8byD3k,"ITZY (있지) ""WANNABE"" (Color Coded Lyrics Eng/Rom/Han/가사)",UgzODYG8zs2WrTGTOVN4AaABAg,The vocals are everything,UCaNSubyfcFYS5Dw5lXyejyQ,¡ lizbeth !,1,2020-03-27T03:09:20Z,2020-03-27T03:09:20Z
bMSkW8byD3k,"ITZY (있지) ""WANNABE"" (Color Coded Lyrics Eng/Rom/Han/가사)",Ugx25gIYEb7pgvaQYix4AaABAg,"Viciei é pouco, tô ouvindo toda hora",UCpgRHd67KLlO9Tm3DO5B27Q,Edi_Mara S_S,1,2020-07-13T12:52:12Z,2020-07-13T12:52:12Z
bMSkW8byD3k,"ITZY (있지) ""WANNABE"" (Color Coded Lyrics Eng/Rom/Han/가사)",UgybrcEcqOQc7SnHynx4AaABAg,"I really love the meaning of this song❤️ i was in the state of ""whatever i do, they say it as wrong"" but now i just wanna be me without worry what people say, so thanks to the translator for translating this song",UCRpmOqo0BxqhqJwHLCmQQog,H__J__9902,1,2020-05-29T16:01:23Z,2020-05-29T16:01:23Z
bMSkW8byD3k,"ITZY (있지) ""WANNABE"" (Color Coded Lyrics Eng/Rom/Han/가사)",UgwhpPeon9vY_MzW_KN4AaABAg,Yeji's voice is on onther level   😌💞👑,UCCDQNDri0zJJ7HxGlaQRbsw,Mia !,4,2022-08-08T22:47:49Z,2022-09-18T22:49:18Z
bMSkW8byD3k,"ITZY (있지) ""WANNABE"" (Color Coded Lyrics Eng/Rom/Han/가사)",UgxtPh0vummbWAFT4Vh4AaABAg,Yuna doesn’t have a lot of lines but I really love her parts,UC0f5KmpPDwCiY-ZcpXumQ6g,Set Me Free,904,2020-03-09T09:43:15Z,2020-03-09T09:43:15Z
bMSkW8byD3k,"ITZY (있지) ""WANNABE"" (Color Coded Lyrics Eng/Rom/Han/가사)",UgyyTOs_LLG1YSVKs4h4AaABAg,If they perform this song at award show.. All the idols will move their shoulder here n there😂,UCR5N4rUNqMADqp5tiJOV_eA,yuyosmeow,9430,2020-04-21T07:37:02Z,2020-04-21T07:37:02Z
bMSkW8byD3k,"ITZY (있지) ""WANNABE"" (Color Coded Lyrics Eng/Rom/Han/가사)",UgzrpMy-F8qunbWK0QR4AaABAg,"The MV is Good
The Voice is Good
The Dance is Good
The Face is Good
The Message is Good
 
EVERYTHING IS GOOD WTH!!",UCj6C3YH8-1YQFdCBgk4z95w,Kearvin Santillesis,5,2020-03-24T16:39:33Z,2020-03-24T16:39:33Z
bMSkW8byD3k,"ITZY (있지) ""WANNABE"" (Color Coded Lyrics Eng/Rom/Han/가사)",Ugw8P7nRcHmBG_naRkV4AaABAg,"I really love this song. 
I love it even more now that I read the lyrics",UCt6m-juA_V5NxczRF_LcQrw,Marta Baiano,1,2023-06-30T08:31:05Z,2023-06-30T08:31:05Z
bMSkW8byD3k,"ITZY (있지) ""WANNABE"" (Color Coded Lyrics Eng/Rom/Han/가사)",Ugz8A2VcOF3db7uahcp4AaABAg,i love this song its my favourite,UCt2xQ4mMklyWwthoemI-zEQ,CookieGame,4,2023-03-17T12:01:51Z,2023-03-17T12:01:51Z
bMSkW8byD3k,"ITZY (있지) ""WANNABE"" (Color Coded Lyrics Eng/Rom/Han/가사)",UgxUTJ-3b_7QOhrkSi14AaABAg,This was the song that got me into ITZY (Ryujin's Voice) and i hadn't listened to it in a while so i came to watch it and now i remember why Ryujin's voice hit me like that.,UCcjX2YdghNbpZX117eAKI-w,PlanetZoom,15,2020-10-05T20:08:47Z,2020-10-05T20:08:47Z
bMSkW8byD3k,"ITZY (있지) ""WANNABE"" (Color Coded Lyrics Eng/Rom/Han/가사)",UgwTo4TUky2GLKYbf8t4AaABAg,""" _I'd rather be selfish, it's hundred times better than pretending to be nice and get hurt_ ""




damn yuna, this line is 🔥",UCwzj3zMtBbHpn2scaowQlHw,yOur behAviOur is sO uGhHHhH,471,2020-03-09T15:13:59Z,2020-03-09T15:14:27Z
bMSkW8byD3k,"ITZY (있지) ""WANNABE"" (Color Coded Lyrics Eng/Rom/Han/가사)",UgwqCi1rn7rExIdkJNp4AaABAg,2:25 these lines are so addictive and lyrics is so awesome if you feel  me turn this beat up 😭😀,UClHGTAorQEPJ15C4xKG54ow,Aamir Muhammad,2,2022-06-19T12:54:43Z,2022-06-19T12:54:43Z
bMSkW8byD3k,"ITZY (있지) ""WANNABE"" (Color Coded Lyrics Eng/Rom/Han/가사)",Ugyb-tJqoE-fd_N1AMF4AaABAg,what a bop. I hated their other songs but this one I instantly loved,UCVvsmWxSsWPuI6OQmXNNfPA,iiTrendyz,0,2020-04-02T10:53:55Z,2020-04-02T10:53:55Z
bMSkW8byD3k,"ITZY (있지) ""WANNABE"" (Color Coded Lyrics Eng/Rom/Han/가사)",UgyvrCRqV4oPb0cGCB54AaABAg,you know that it's an iconic song when you can imagine each scene from the MV when you're watching a lyric video,UCE76BurOB-nc_66g5pN7MOg,whew,5,2020-07-11T10:42:06Z,2020-07-11T10:42:06Z
bMSkW8byD3k,"ITZY (있지) ""WANNABE"" (Color Coded Lyrics Eng/Rom/Han/가사)",UgwJsVGq2noLP-8dlIR4AaABAg,"0:33 I keep replaying when she says ""I'm so bad bad"" it's just so addictive😂😍",UCzwLAK0UghSx7zzIcjOTKxA,emperorsmile,7,2020-03-28T13:59:02Z,2020-03-28T13:59:02Z
bMSkW8byD3k,"ITZY (있지) ""WANNABE"" (Color Coded Lyrics Eng/Rom/Han/가사)",UgwLwdpOj2rDPpm8mmB4AaABAg,This song always encourages me!💕❄️,UCc4mNzJEJcA_EttSwXKIAnA,Rebels,10,2022-02-01T15:51:06Z,2022-02-01T15:51:06Z
bMSkW8byD3k,"ITZY (있지) ""WANNABE"" (Color Coded Lyrics Eng/Rom/Han/가사)",UgzWMnTX467WMw34Wld4AaABAg,"""How perfect you want your new comeback to be?""

ITZY: *yes~*",UCBuMQWv-O2uatt-7lIu1IyQ,Ah excuji meee I was born in Busan first,184,2020-03-09T09:41:47Z,2020-03-09T09:41:47Z
bMSkW8byD3k,"ITZY (있지) ""WANNABE"" (Color Coded Lyrics Eng/Rom/Han/가사)",UgyUPkVNbHmLdWDtAId4AaABAg,I’m not an itzy fan but I love this so much! 💜,UCC-IIc0vNmtGjPczeHSBijQ,Muhajjem Ahmed,4,2020-11-14T23:34:11Z,2020-11-14T23:34:11Z
bMSkW8byD3k,"ITZY (있지) ""WANNABE"" (Color Coded Lyrics Eng/Rom/Han/가사)",Ugxkfmrf1RdD6hHI0Kp4AaABAg,Their voices are just soo young and refreshing like them :),UCJcAe9QG3EVicnRlK8K9RGg,_cute _taelien,0,2020-05-06T18:03:12Z,2020-05-06T18:03:12Z
bMSkW8byD3k,"ITZY (있지) ""WANNABE"" (Color Coded Lyrics Eng/Rom/Han/가사)",UgwmxYbtxnDGZv4WBpd4AaABAg,GO YEJI I LOVE YOU FROM THE BOTTOM OF MY HEART ❤️,UCht-LAj6YGpdxYfiKC417jA,Fun with Talia,6,2022-04-07T04:53:27Z,2022-04-07T04:53:27Z
bMSkW8byD3k,"ITZY (있지) ""WANNABE"" (Color Coded Lyrics Eng/Rom/Han/가사)",UgwRqophkhUBisloJpt4AaABAg,This song is a bop and it could never get old,UCLz7XlbhadNrMwXKXBrfNsw,Glow Salgado,0,2020-04-16T15:35:32Z,2020-04-16T15:35:32Z
bMSkW8byD3k,"ITZY (있지) ""WANNABE"" (Color Coded Lyrics Eng/Rom/Han/가사)",UgypACBJqSUOQP5N2g14AaABAg,"Ryujin and her voice is the reason I came onto Itzy and also this song. Truly she is impressive, and ofcourse the goddess!!!!❤️♥️😚🤩😍😍😍",UCawInpif0uMSa5g0GY_RwVg,Pratistha Kashyap,4,2020-10-15T12:10:54Z,2020-10-15T12:12:18Z
bMSkW8byD3k,"ITZY (있지) ""WANNABE"" (Color Coded Lyrics Eng/Rom/Han/가사)",UgwEpmHgmitouZ6T4JJ4AaABAg,"honestly, it’s so sad how people are still hating on them, especially lia. she’s not “lazy” & never will be, she’s so hard working & beautiful!",UC5DzXV4syeUX4OoDqbcYGDQ,Anna Liu,577,2020-03-14T12:17:11Z,2020-03-14T12:17:11Z
bMSkW8byD3k,"ITZY (있지) ""WANNABE"" (Color Coded Lyrics Eng/Rom/Han/가사)",Ugy8jzWXAEcxaNmRzi94AaABAg,Can we just appreciate the meaning behind the song ?SOOO POWERFUL FOR THE KPOP WORLD,UCRyZ480f5N_iY1GA8XEKCZQ,Mary-Ann M,0,2020-04-06T23:11:22Z,2020-04-06T23:11:22Z
bMSkW8byD3k,"ITZY (있지) ""WANNABE"" (Color Coded Lyrics Eng/Rom/Han/가사)",UgxOMuOCGBfcrmVe9AV4AaABAg,"all things aside, this song has a really great message🖤",UCTmfqQD6h736lQfjGAKvVKg,tiffanie,1,2020-03-31T10:22:13Z,2020-03-31T10:22:13Z
bMSkW8byD3k,"ITZY (있지) ""WANNABE"" (Color Coded Lyrics Eng/Rom/Han/가사)",UgzTbp32HM7GyOiQq1B4AaABAg,"I'm a grown up woman and I like this song so much. The message in it is very empowering! We need more songs like this one.
Thanks for the video.",UC2IxK4-hgP6DNlxt3lX_tLQ,Bárbara,2,2020-08-15T23:38:30Z,2020-08-15T23:38:30Z
bMSkW8byD3k,"ITZY (있지) ""WANNABE"" (Color Coded Lyrics Eng/Rom/Han/가사)",UgzeVA5wbsbtl0uHL854AaABAg,"Mds!!
Essa música é muito top!!!!
Cadê os brasileiros?!",UCGX7veYTdNNTwkFpccJAlAQ,queijo com pão,2,2020-06-01T21:08:12Z,2020-06-01T21:08:12Z
bMSkW8byD3k,"ITZY (있지) ""WANNABE"" (Color Coded Lyrics Eng/Rom/Han/가사)",Ugxq46bUUqRue8535oN4AaABAg,가사가 너무 좋다,UCHgQMlR9-LBystQtdvLwWtg,흐흐,2,2020-07-26T06:27:43Z,2020-07-26T06:27:43Z
bMSkW8byD3k,"ITZY (있지) ""WANNABE"" (Color Coded Lyrics Eng/Rom/Han/가사)",Ugx5NQErGRk_zalDXrt4AaABAg,"Not just this song, but all of the songs they have so far are just so positive😍 If you ever feel self conscious just sing itzy songs and mean it, build up that self confidence 💫",UC4zYGucmERafW1MkJF3Yt1A,Accidantal,8,2020-03-16T02:19:34Z,2020-03-16T02:19:34Z
bMSkW8byD3k,"ITZY (있지) ""WANNABE"" (Color Coded Lyrics Eng/Rom/Han/가사)",UgxGSWiKxT2nS80Vk3J4AaABAg,"siento q la letra de esta cancion la deben aplicar en sus vidas ya q trae un mensaje muy bueno y absolutamente todo lo q dice es verdad, por q a la gente le gusta hablar de los demas sin saber de ellos y sin saber su historia unu. no le den importancia a cosas q no les incumbe no te metas en la vida de los demas y tampoco les digas q hacer. Solo preocupate por tu vida sin dañar a los demas y recuerda ser tu mismo :D",UCjmSB6F6Yf3X_sW6gw4AoKw,Shanti Jai Calderon,3,2020-04-03T03:02:59Z,2020-04-03T03:02:59Z
bMSkW8byD3k,"ITZY (있지) ""WANNABE"" (Color Coded Lyrics Eng/Rom/Han/가사)",Ugyk6ScBVQC7XGxokc14AaABAg,i just love how JYP gives them the best management and the best things. That's why i always love JYP and it's my top agencies. Such a good man and knows how to work,UCUZZT6jtGuYvz1K0Psod79w,ニーナzeus 니나,2,2020-04-21T09:56:44Z,2020-04-21T09:56:44Z
bMSkW8byD3k,"ITZY (있지) ""WANNABE"" (Color Coded Lyrics Eng/Rom/Han/가사)",Ugy5bJrmtf-AJtDHgNB4AaABAg,loved it,UC4upC3KbQNIB_H_c7tDpgdg,Illestbi ♡,4,2022-05-09T11:43:32Z,2022-05-09T11:43:32Z
bMSkW8byD3k,"ITZY (있지) ""WANNABE"" (Color Coded Lyrics Eng/Rom/Han/가사)",UgzWLgOqhtERHCVq_hl4AaABAg,Thank you for the lyrics 💕😄,UC1iKy8MqSE1YhZDlbuGYmew,RYUJIN’S SHOULDERS,3,2020-03-22T18:41:07Z,2020-03-22T18:41:07Z
bMSkW8byD3k,"ITZY (있지) ""WANNABE"" (Color Coded Lyrics Eng/Rom/Han/가사)",UgylKJXxB-RmNqZ4QgV4AaABAg,"me and my cousin tried to dance and sing this in the same time, we sounded good but it was hard, like how are their voices so stable while dancing this",UCsKS7mQXOd5QoWmqAnXsK3w,리아Liah,5,2021-10-02T09:55:22Z,2021-10-02T09:55:22Z
