title,textDisplay,parentId,authorChannelId,authorDisplayName,likeCount,publishedAt
ITZY - 'ICY' [ENGLISH VERSION] Lyrics [Color Coded_Eng],I like this english version better than the korean strangely..,Ugx9l-beSzY9s4TayIN4AaABAg,UClEaZ4KpE1TcExTzYEbj1vQ,satria222poxy,3641,2021-01-22T06:22:49Z
ITZY - 'ICY' [ENGLISH VERSION] Lyrics [Color Coded_Eng],I love original version but this also slaps,Ugx9l-beSzY9s4TayIN4AaABAg,UC17E_yOVm7ysrZQmghLEjDg,minari is here to be loved :),305,2021-01-22T09:32:21Z
ITZY - 'ICY' [ENGLISH VERSION] Lyrics [Color Coded_Eng],Somehow I like all their title tracks in English except Not Shy,Ugx9l-beSzY9s4TayIN4AaABAg,UCxZCiyKGdKIfeKUgljQ_6AA,Tsu Chan,218,2021-01-22T10:01:01Z
ITZY - 'ICY' [ENGLISH VERSION] Lyrics [Color Coded_Eng],i think it’s because their english is so good and that half of their lyrics were already in english,Ugx9l-beSzY9s4TayIN4AaABAg,UCQAaCfuh2ohpU80jlehTOvA,Sarai Chance,153,2021-01-22T11:36:42Z
ITZY - 'ICY' [ENGLISH VERSION] Lyrics [Color Coded_Eng],Wannabe is so good in eng and also i love the lyrics,Ugx9l-beSzY9s4TayIN4AaABAg,UC5fmAD6m_UC5aCJv-ON1iXg,khan,65,2021-01-22T12:13:00Z
ITZY - 'ICY' [ENGLISH VERSION] Lyrics [Color Coded_Eng],@Tsu Chan I love all of their English tracks and Not Shy is actually my fave English Version!,Ugx9l-beSzY9s4TayIN4AaABAg,UCO-MQEqDPYyb9S_AUcr7XJg,Hey!,40,2021-01-22T12:31:43Z
ITZY - 'ICY' [ENGLISH VERSION] Lyrics [Color Coded_Eng],@Tsu Chan Not shy sounds weird to me. i can’t sing it in english I have to sing it in korean. When I sing it in english it’s like i forget how to talk 😂😂,Ugx9l-beSzY9s4TayIN4AaABAg,UC8H_tTZhd6wFuUxQwVBVw7g,Sophia Ynclan,40,2021-01-22T16:14:32Z
ITZY - 'ICY' [ENGLISH VERSION] Lyrics [Color Coded_Eng],Anyone notice that lia voice is a bit lower then the Korean version but I love it and man I love this group,Ugx9l-beSzY9s4TayIN4AaABAg,UC4uodtffTXLvbIwwTSymi_g,Danny,21,2021-01-22T16:21:33Z
ITZY - 'ICY' [ENGLISH VERSION] Lyrics [Color Coded_Eng],it’s so much betterrr,Ugx9l-beSzY9s4TayIN4AaABAg,UCTxQFJa0Szi7lBgMbELesQA,fallenfortzuyu,5,2021-01-22T20:48:52Z
ITZY - 'ICY' [ENGLISH VERSION] Lyrics [Color Coded_Eng],Probably because it’s easier to understand,Ugx9l-beSzY9s4TayIN4AaABAg,UCHuL5qogPo0mVZ1CjA9haTA,KpopMinnie-Yunjinnie,1,2021-01-22T23:46:32Z
ITZY - 'ICY' [ENGLISH VERSION] Lyrics [Color Coded_Eng],I like both😌,Ugx9l-beSzY9s4TayIN4AaABAg,UCsUGAmxII4Csesef7PXb73Q,sana,0,2021-01-23T04:06:12Z
ITZY - 'ICY' [ENGLISH VERSION] Lyrics [Color Coded_Eng],I like both,Ugx9l-beSzY9s4TayIN4AaABAg,UC7uGe80gPDwq1LoBNrBpYHQ,wow,0,2021-01-23T04:07:47Z
ITZY - 'ICY' [ENGLISH VERSION] Lyrics [Color Coded_Eng],@Tsu Chan yah same,Ugx9l-beSzY9s4TayIN4AaABAg,UCvjT0Obt2IrMmz0Uj21SHlA,Ellen Bitch,0,2021-01-23T10:07:57Z
ITZY - 'ICY' [ENGLISH VERSION] Lyrics [Color Coded_Eng],Original is so much better but this is good too,Ugx9l-beSzY9s4TayIN4AaABAg,UCtWdMA-auoBprO2bESZYfRg,Yariha,2,2021-01-23T12:49:15Z
ITZY - 'ICY' [ENGLISH VERSION] Lyrics [Color Coded_Eng],There vocals are stronger in this version,Ugx9l-beSzY9s4TayIN4AaABAg,UCoenK5RMrC2ejjMrQysswAg,K-Popfolife,1,2021-01-23T12:51:20Z
ITZY - 'ICY' [ENGLISH VERSION] Lyrics [Color Coded_Eng],I loce the original but this is also a bop,Ugx9l-beSzY9s4TayIN4AaABAg,UCKGOhHR_uO4yAf3SN6vaMlw,harshil midzy,1,2021-01-24T06:41:20Z
ITZY - 'ICY' [ENGLISH VERSION] Lyrics [Color Coded_Eng],I know right this english slaps hard,Ugx9l-beSzY9s4TayIN4AaABAg,UCKUNnh6rVAtMFTRvhaPmLlg,Kristel Magdael,0,2021-01-25T00:57:20Z
ITZY - 'ICY' [ENGLISH VERSION] Lyrics [Color Coded_Eng],Same!?!,Ugx9l-beSzY9s4TayIN4AaABAg,UCA_N7pC_onxZ4yHz85IpOqA,LeviOsa!,0,2021-01-25T14:13:31Z
ITZY - 'ICY' [ENGLISH VERSION] Lyrics [Color Coded_Eng],Thyxs 123 yeah,Ugx9l-beSzY9s4TayIN4AaABAg,UC8H_tTZhd6wFuUxQwVBVw7g,Sophia Ynclan,0,2021-01-25T17:03:37Z
ITZY - 'ICY' [ENGLISH VERSION] Lyrics [Color Coded_Eng],Me too i also like this version better,Ugx9l-beSzY9s4TayIN4AaABAg,UC4BhvC-B-C2Q8aCy7rHiYew,Krish Mukherjee,1,2021-01-25T18:38:02Z
ITZY - 'ICY' [ENGLISH VERSION] Lyrics [Color Coded_Eng],@KpopMinnie-Yunjinnie i dont think so. for some songs i like the korean version better than the english ones,Ugx9l-beSzY9s4TayIN4AaABAg,UCrP2IYh6lXxulazzw2ny-aw,Tina Love,0,2021-01-26T23:02:06Z
ITZY - 'ICY' [ENGLISH VERSION] Lyrics [Color Coded_Eng],"@Tsu Chan Strangely, I love the english version of not shy 🥺",Ugx9l-beSzY9s4TayIN4AaABAg,UCi8KOeQGhnMuQN9nFTYoAZg,Krizia Itao,0,2021-01-27T23:02:08Z
ITZY - 'ICY' [ENGLISH VERSION] Lyrics [Color Coded_Eng],Me too,Ugx9l-beSzY9s4TayIN4AaABAg,UCM-Uy8a9FW80AgIAk5mBYtQ,Sanchita Sahana,0,2021-01-30T12:42:16Z
ITZY - 'ICY' [ENGLISH VERSION] Lyrics [Color Coded_Eng],"me too, I mean I can understand all the lyrics and it&#39;s awesome...",Ugx9l-beSzY9s4TayIN4AaABAg,UCmfd53tfy5dc9_NV36g_69w,Bena Garkaz,0,2021-01-30T19:00:41Z
ITZY - 'ICY' [ENGLISH VERSION] Lyrics [Color Coded_Eng],Prob cuz you know english but not korean lol,Ugx9l-beSzY9s4TayIN4AaABAg,UCbEfLSYIgV60fEmOWcbMq_g,Zey,0,2021-02-08T19:19:41Z
ITZY - 'ICY' [ENGLISH VERSION] Lyrics [Color Coded_Eng],"me as well, this eng version like the best among the others eng version",Ugx9l-beSzY9s4TayIN4AaABAg,UCVbQTDF7mjpT1r5Chm67GxQ,andre firmansyah,0,2021-02-13T18:20:18Z
ITZY - 'ICY' [ENGLISH VERSION] Lyrics [Color Coded_Eng],Honestly same I usually don’t say that with K-pop songs but for some reason ITZY’S English versions of their songs really be hitting the nail on the head!!,Ugx9l-beSzY9s4TayIN4AaABAg,UCwG8mN74qDZ0uPZRZ9Kd6MA,Jianna Koes,0,2021-03-03T23:33:58Z
ITZY - 'ICY' [ENGLISH VERSION] Lyrics [Color Coded_Eng],@Tsu Chan woah that’s weird. Not Shy in English is my favorite lol,Ugx9l-beSzY9s4TayIN4AaABAg,UC3NSoUqTRhqk8s8gC9SCfCw,Robin Pari,0,2021-03-15T09:32:23Z
ITZY - 'ICY' [ENGLISH VERSION] Lyrics [Color Coded_Eng],I love any itzy song!,Ugx9l-beSzY9s4TayIN4AaABAg,UCd31hyM6op9dDHPeIMckgog,GYANENDRA PRAKASH,0,2021-04-05T15:33:07Z
ITZY - 'ICY' [ENGLISH VERSION] Lyrics [Color Coded_Eng],same cause i can understand the message more,Ugx9l-beSzY9s4TayIN4AaABAg,UCRLd3kFar23mi1zKXGcj9Ag,Zi’Nah,1,2021-04-08T01:40:09Z
ITZY - 'ICY' [ENGLISH VERSION] Lyrics [Color Coded_Eng],It’s because you CAN understand the message,Ugx9l-beSzY9s4TayIN4AaABAg,UCd9VHh7SYgzMFma_1IKvH7A,Kimwonoo,0,2021-04-22T23:00:52Z
ITZY - 'ICY' [ENGLISH VERSION] Lyrics [Color Coded_Eng],Most of the time English version sound kind of tacky but this one IS SO SMOOTH AND GOOD 😌,Ugx9l-beSzY9s4TayIN4AaABAg,UCpZG3xy8F6bj7uDNb_zFsVA,KaoTao,0,2021-07-13T15:59:44Z
ITZY - 'ICY' [ENGLISH VERSION] Lyrics [Color Coded_Eng],Yassss!,Ugx9l-beSzY9s4TayIN4AaABAg,UCFUMbCIwVEwNt5cnO8QleTA,Lena Radosława Dunaszewska,0,2021-08-05T09:14:57Z
ITZY - 'ICY' [ENGLISH VERSION] Lyrics [Color Coded_Eng],Ya think maybe too,Ugx9l-beSzY9s4TayIN4AaABAg,UCD5Y9Ed5-pkTCH7JPv5ztRw,Sorfina 🎃🎃,0,2021-08-21T13:17:53Z
ITZY - 'ICY' [ENGLISH VERSION] Lyrics [Color Coded_Eng],If there is a english ver. I tend to always like that more over korean..  Cause I know the language.,Ugx9l-beSzY9s4TayIN4AaABAg,UCYPz7hR1MCFd2rX5XiOQSig,Suchi Jha,0,2021-09-28T15:16:02Z
ITZY - 'ICY' [ENGLISH VERSION] Lyrics [Color Coded_Eng],me to,Ugx9l-beSzY9s4TayIN4AaABAg,UCu6ef3OmvpwFdCFE8mKsWLA,tokey mania mobile,0,2021-11-05T06:41:42Z
ITZY - 'ICY' [ENGLISH VERSION] Lyrics [Color Coded_Eng],Same I like the original better but this is ok to,Ugx9l-beSzY9s4TayIN4AaABAg,UCozlhqcjMqmkz6ZVTHtsTrA,Blueish,0,2021-11-13T13:53:48Z
ITZY - 'ICY' [ENGLISH VERSION] Lyrics [Color Coded_Eng],"I found this song by my friend, it is sooo cool.",Ugx9l-beSzY9s4TayIN4AaABAg,UCpUZN8ilpwYnvrZUctkisdw,Hanim Zuhairaa,0,2021-12-04T12:23:08Z
ITZY - 'ICY' [ENGLISH VERSION] Lyrics [Color Coded_Eng],@Tsu Chan fr😭 thought I was the one who didn&#39;t like not shy english version some parts sound weird,Ugx9l-beSzY9s4TayIN4AaABAg,UC-oVIJRr-ziZBp7RnJkcfLw,SpongeBobs cheeks,0,2021-12-05T21:42:14Z
ITZY - 'ICY' [ENGLISH VERSION] Lyrics [Color Coded_Eng],"I mean, as international fans that&#39;s obviously what we&#39;re gonna prefer",Ugx9l-beSzY9s4TayIN4AaABAg,UC9M6tzb-tizP1faGzbxYHBw,Random,0,2022-01-08T20:12:26Z
ITZY - 'ICY' [ENGLISH VERSION] Lyrics [Color Coded_Eng],Me too,Ugx9l-beSzY9s4TayIN4AaABAg,UCF8NA0lmXK5syTYKHSvgfqw,Pönde,0,2022-02-20T16:03:46Z
ITZY - 'ICY' [ENGLISH VERSION] Lyrics [Color Coded_Eng],Same 😆,Ugx9l-beSzY9s4TayIN4AaABAg,UC37xw7y4ECSNPaYW8gZeGhg,Phương Dung,0,2022-03-30T15:19:26Z
ITZY - 'ICY' [ENGLISH VERSION] Lyrics [Color Coded_Eng],Whoop beep beep,Ugx9l-beSzY9s4TayIN4AaABAg,UCosT8dK-ecqy_JLrlmYlXJA,Lachimolala,0,2022-04-14T15:38:25Z
ITZY - 'ICY' [ENGLISH VERSION] Lyrics [Color Coded_Eng],Especially &#39;loco&#39;,Ugx9l-beSzY9s4TayIN4AaABAg,UCDEVTtiPiEewSNMMiOPCcbA,park luna,0,2022-04-17T20:14:43Z
